{
  "productName": "",
  "slug": "",
  "clientId": "",
  "projectId": "",
  "generatedAt": "",
  "requestPath": "",
  "sourceFiles": [],
  "verifiedFacts": [],
  "inferredFacts": [],
  "assumptions": [],
  "pendingValidation": [],
  "dimensions": { "length_mm": null, "width_mm": null, "height_mm": null, "depth_mm": null, "source": "pending" },
  "materials": [],
  "components": [],
  "variants": [],
  "modelingStrategy": "not_yet_determined",
  "outputFiles": { "glb": null, "sourceScript": null, "report": null, "previews": [] },
  "fileSize": null,
  "polygonCount": null,
  "confidence": "low",
  "qaStatus": "not_started",
  "nextActions": []
}
